{
  "schema_version": 2,
  "dataset_id": "rag-evaluation-v2-enterprise-smart-office-draft",
  "status": "FROZEN",
  "synthetic": true,
  "created_at": "2026-08-29T00:00:00Z",
  "ground_truth_policy": "Labels are authored only from source Markdown locators; no retrieval or reranker output was consulted.",
  "cases": [
    {
      "query_id": "v2q001",
      "query": "A100 V1 使用什么规格的电源适配器？",
      "category": "exact_fact",
      "answerable": true,
      "relevant_documents": [
        "EVAL-A100-V1"
      ],
      "relevant_locators": [
        "A100V1-POWER"
      ],
      "reference_answer": "12 V/3 A 圆口适配器。",
      "evidence": [
        "A100 V1 使用 12 V/3 A 圆口适配器。通电后状态灯先呈白色约 40 秒，完成启动后转为绿色。安装时应在设备两侧各保留至少 8 cm 散热空间，不得放入封闭抽屉。"
      ],
      "notes": "明确硬件事实。",
      "tags": [],
      "difficulty": "easy",
      "requires_parent_context": false,
      "requires_multi_document": false,
      "expected_version": "1.0",
      "review_status": "self_reviewed"
    },
    {
      "query_id": "v2q002",
      "query": "A100 V2 正常启动大约需要多久？",
      "category": "exact_fact",
      "answerable": true,
      "relevant_documents": [
        "EVAL-A100-V2"
      ],
      "relevant_locators": [
        "A100V2-POWER"
      ],
      "reference_answer": "约 25 秒。",
      "evidence": [
        "A100 V2 使用 USB-C PD 45 W 供电。正常启动约需 25 秒，指示灯由紫色呼吸转为绿色常亮。设备两侧各保留 5 cm 即可，但顶部散热孔不得覆盖。"
      ],
      "notes": "版本明确的启动参数。",
      "tags": [],
      "difficulty": "easy",
      "requires_parent_context": false,
      "requires_multi_document": false,
      "expected_version": "2.0",
      "review_status": "self_reviewed"
    },
    {
      "query_id": "v2q003",
      "query": "A200 机柜进风温度上限是多少？",
      "category": "exact_fact",
      "answerable": true,
      "relevant_documents": [
        "EVAL-A200"
      ],
      "relevant_locators": [
        "A200-POWER"
      ],
      "reference_answer": "应低于 35℃。",
      "evidence": [
        "A200 主机使用 24 V/5 A 适配器，摄像机通过 PoE+ 交换机供电。机柜前后至少各留 15 cm，并保持进风温度低于 35℃。"
      ],
      "notes": "环境约束。",
      "tags": [],
      "difficulty": "easy",
      "requires_parent_context": false,
      "requires_multi_document": false,
      "expected_version": "1.3",
      "review_status": "self_reviewed"
    },
    {
      "query_id": "v2q004",
      "query": "A100 V1 的配对码有效几分钟？",
      "category": "exact_fact",
      "answerable": true,
      "relevant_documents": [
        "EVAL-A100-V1"
      ],
      "relevant_locators": [
        "A100V1-PAIR"
      ],
      "reference_answer": "10 分钟。",
      "evidence": [
        "管理员在终端输入六位配对码，配对码有效期 10 分钟。连续输入错误 5 次后，配对入口暂停 15 分钟，但设备本身不会退出已加入的会议。"
      ],
      "notes": "短事实。",
      "tags": [],
      "difficulty": "easy",
      "requires_parent_context": false,
      "requires_multi_document": false,
      "expected_version": "1.0",
      "review_status": "self_reviewed"
    },
    {
      "query_id": "v2q005",
      "query": "A100 V2 配对连续错误几次会锁定？",
      "category": "exact_fact",
      "answerable": true,
      "relevant_documents": [
        "EVAL-A100-V2"
      ],
      "relevant_locators": [
        "A100V2-PAIR"
      ],
      "reference_answer": "连续 3 次。",
      "evidence": [
        "六位配对码有效期缩短为 5 分钟。连续输入错误 3 次后，当前管理员账号锁定 20 分钟；其他已授权管理员仍可登录。"
      ],
      "notes": "版本特定阈值。",
      "tags": [],
      "difficulty": "easy",
      "requires_parent_context": false,
      "requires_multi_document": false,
      "expected_version": "2.0",
      "review_status": "self_reviewed"
    },
    {
      "query_id": "v2q006",
      "query": "A200 最多能级联多少个 M20 麦克风阵列？",
      "category": "exact_fact",
      "answerable": true,
      "relevant_documents": [
        "EVAL-A200"
      ],
      "relevant_locators": [
        "A200-AUDIO"
      ],
      "reference_answer": "4 个。",
      "evidence": [
        "主机最多级联 4 个 M20 麦克风阵列。链路超过 30 米时必须使用光电转换模块；普通网线延长器不在支持范围内。"
      ],
      "notes": "容量事实。",
      "tags": [],
      "difficulty": "easy",
      "requires_parent_context": false,
      "requires_multi_document": false,
      "expected_version": "1.3",
      "review_status": "self_reviewed"
    },
    {
      "query_id": "v2q007",
      "query": "终端注册需要放通哪个 TCP 端口？",
      "category": "exact_fact",
      "answerable": true,
      "relevant_documents": [
        "EVAL-DEPLOY"
      ],
      "relevant_locators": [
        "DEPLOY-PORTS"
      ],
      "reference_answer": "TCP 443 出站。",
      "evidence": [
        "| 用途 | 协议 | 端口 | 方向 | |---|---|---:|---| | 设备注册 | TCP | 443 | 出站 | | 会议信令 | TCP | 8443 | 出站 | | 实时媒体 | UDP | 30000-31999 | 双向 | | 时间同步 | UDP | 123 | 出站 |"
      ],
      "notes": "端口表事实。",
      "tags": [
        "table"
      ],
      "difficulty": "easy",
      "requires_parent_context": false,
      "requires_multi_document": false,
      "expected_version": null,
      "review_status": "self_reviewed"
    },
    {
      "query_id": "v2q008",
      "query": "视频媒体应该使用哪个 DSCP 值？",
      "category": "exact_fact",
      "answerable": true,
      "relevant_documents": [
        "EVAL-DEPLOY"
      ],
      "relevant_locators": [
        "DEPLOY-QOS"
      ],
      "reference_answer": "DSCP 34。",
      "evidence": [
        "音频媒体标记为 DSCP 46，视频媒体标记为 DSCP 34，信令标记为 DSCP 24。若网络设备会重写 DSCP，应在出口策略中重新标记，而不是在终端上反复保存配置。"
      ],
      "notes": "网络配置事实。",
      "tags": [],
      "difficulty": "easy",
      "requires_parent_context": false,
      "requires_multi_document": false,
      "expected_version": null,
      "review_status": "self_reviewed"
    },
    {
      "query_id": "v2q009",
      "query": "NTP 偏差超过多少会导致证书认证失败？",
      "category": "exact_fact",
      "answerable": true,
      "relevant_documents": [
        "EVAL-DEPLOY"
      ],
      "relevant_locators": [
        "DEPLOY-DNS"
      ],
      "reference_answer": "90 秒。",
      "evidence": [
        "终端必须解析 `meet.synthetic.example` 与 `update.synthetic.example`。NTP 偏差超过 90 秒会导致证书认证失败；推荐配置两个独立时间源。"
      ],
      "notes": "通用部署事实。",
      "tags": [],
      "difficulty": "easy",
      "requires_parent_context": false,
      "requires_multi_document": false,
      "expected_version": null,
      "review_status": "self_reviewed"
    },
    {
      "query_id": "v2q010",
      "query": "N201 错误码是什么意思？",
      "category": "exact_fact",
      "answerable": true,
      "relevant_documents": [
        "EVAL-NETWORK"
      ],
      "relevant_locators": [
        "NET-CODE-N201"
      ],
      "reference_answer": "DHCP 在 60 秒内未分配地址。",
      "evidence": [
        "N201 表示 DHCP 在 60 秒内未分配地址。检查 VLAN、地址池余量和 DHCP Relay。它不表示 DNS 故障。"
      ],
      "notes": "错误码事实。",
      "tags": [],
      "difficulty": "easy",
      "requires_parent_context": false,
      "requires_multi_document": false,
      "expected_version": null,
      "review_status": "self_reviewed"
    },
    {
      "query_id": "v2q011",
      "query": "N305 应重点检查哪段端口？",
      "category": "exact_fact",
      "answerable": true,
      "relevant_documents": [
        "EVAL-NETWORK"
      ],
      "relevant_locators": [
        "NET-CODE-N305"
      ],
      "reference_answer": "UDP 30000-31999。",
      "evidence": [
        "N305 表示媒体 UDP 建链超时。若只开放 TCP 8443，设备可以入会但不会获得实时媒体。"
      ],
      "notes": "错误码与端口。",
      "tags": [],
      "difficulty": "easy",
      "requires_parent_context": false,
      "requires_multi_document": false,
      "expected_version": null,
      "review_status": "self_reviewed"
    },
    {
      "query_id": "v2q012",
      "query": "主机标准保修期是多久？",
      "category": "exact_fact",
      "answerable": true,
      "relevant_documents": [
        "EVAL-WARRANTY"
      ],
      "relevant_locators": [
        "WAR-TERM"
      ],
      "reference_answer": "自签收日起 24 个月。",
      "evidence": [
        "主机标准保修期为自签收日起 24 个月；原装适配器、遥控器和麦克风阵列为 12 个月。单独购买的延保必须在主机签收后 90 天内激活。"
      ],
      "notes": "政策事实。",
      "tags": [],
      "difficulty": "easy",
      "requires_parent_context": false,
      "requires_multi_document": false,
      "expected_version": null,
      "review_status": "self_reviewed"
    },
    {
      "query_id": "v2q013",
      "query": "延保最晚应在签收后多久激活？",
      "category": "exact_fact",
      "answerable": true,
      "relevant_documents": [
        "EVAL-WARRANTY"
      ],
      "relevant_locators": [
        "WAR-TERM"
      ],
      "reference_answer": "90 天内。",
      "evidence": [
        "主机标准保修期为自签收日起 24 个月；原装适配器、遥控器和麦克风阵列为 12 个月。单独购买的延保必须在主机签收后 90 天内激活。"
      ],
      "notes": "政策期限。",
      "tags": [],
      "difficulty": "easy",
      "requires_parent_context": false,
      "requires_multi_document": false,
      "expected_version": null,
      "review_status": "self_reviewed"
    },
    {
      "query_id": "v2q014",
      "query": "S1 售后事件首次响应目标是多少？",
      "category": "exact_fact",
      "answerable": true,
      "relevant_documents": [
        "EVAL-WARRANTY"
      ],
      "relevant_locators": [
        "WAR-SLA"
      ],
      "reference_answer": "30 分钟。",
      "evidence": [
        "| 级别 | 示例 | 首次响应目标 | 更新频率 | |---|---|---:|---:| | S1 | 大面积会议中断 | 30 分钟 | 每 2 小时 | | S2 | 单会议室核心功能不可用 | 4 小时 | 每工作日 | | S3 | 咨询或非阻断缺陷 | 1 工作日 | 每 3 工作日 |"
      ],
      "notes": "服务表事实。",
      "tags": [
        "table"
      ],
      "difficulty": "easy",
      "requires_parent_context": false,
      "requires_multi_document": false,
      "expected_version": null,
      "review_status": "self_reviewed"
    },
    {
      "query_id": "v2q015",
      "query": "组织管理员首次登录后有多久绑定 MFA？",
      "category": "exact_fact",
      "answerable": true,
      "relevant_documents": [
        "EVAL-ACCOUNT"
      ],
      "relevant_locators": [
        "ACC-MFA"
      ],
      "reference_answer": "24 小时宽限期。",
      "evidence": [
        "组织管理员和审计员必须启用 MFA。新账号首次登录后有 24 小时宽限期；宽限期结束仍未绑定验证器的账号会被暂停登录。"
      ],
      "notes": "账号安全事实。",
      "tags": [],
      "difficulty": "easy",
      "requires_parent_context": false,
      "requires_multi_document": false,
      "expected_version": null,
      "review_status": "self_reviewed"
    },
    {
      "query_id": "v2q016",